{
  "schema": "fixture-validation-delta-v1",
  "baselinePath": "fixture-validation-prev.json",
  "currentPath": "C:\\codex\\home\\runner\\work\\compare-vi-cli-action\\fixture-validation.json",
  "generatedAt": "2025-10-11T22:22:25.6687326-07:00",
  "baselineOk": true,
  "currentOk": true,
  "deltaCounts": {},
  "changes": [],
  "newStructuralIssues": [],
  "failOnNewStructuralIssue": true,
  "willFail": false
}
