{
  "schema": "fixture-validation-delta-v1",
  "baselinePath": "/home/runner/work/compare-vi-cli-action/compare-vi-cli-action/baseline-fixture-validation.json",
  "currentPath": "/home/runner/work/compare-vi-cli-action/compare-vi-cli-action/current-fixture-validation.json",
  "generatedAt": "2025-10-03T20:47:17.3913624+00:00",
  "baselineOk": true,
  "currentOk": false,
  "deltaCounts": {
    "duplicate": 1
  },
  "changes": [
    {
      "category": "duplicate",
      "baseline": 0,
      "current": 1,
      "delta": 1
    }
  ],
  "newStructuralIssues": [
    {
      "category": "duplicate",
      "baseline": 0,
      "current": 1,
      "delta": 1
    }
  ],
  "failOnNewStructuralIssue": false,
  "willFail": false
}
